,ID,permalink,username,text,date,formatted_date,retweets,favorites,mentions,hashtags,geo,urls,author_id
237,1209329581502550016,https://twitter.com/swarajk7/status/1209329581502550016,,"Yoshua also said, current deep learning system are not good enough to perform on input distribution with zero training set probability. This is a very good example. #AIDebate https:// twitter.com/raamana_/statu s/1209281930295939072 …",2019-12-24 04:26:55,Tue Dec 24 04:26:55 +0000 2019,5,12,,#AIDebate,,https://twitter.com/raamana_/status/1209281930295939072,303651980
238,1209324436060426240,https://twitter.com/alenushka/status/1209324436060426240,,"Is theater of consciousness a symbolic system or a factor graph or possibly neither? #AIdebate , enjoyed the debate, many open questions",2019-12-24 04:06:28,Tue Dec 24 04:06:28 +0000 2019,3,11,,#AIdebate,,,11773812
239,1209322661605601280,https://twitter.com/keschh/status/1209322661605601280,,"At @seapinebrewing drinking their Flannel Channel Winter Ale, listening to 90's hip hop, and reading #AIDebate Twitter comments. Life is good. #AI4beer #beer4AI",2019-12-24 03:59:25,Tue Dec 24 03:59:25 +0000 2019,0,5,@seapinebrewing,#AIDebate #AI4beer #beer4AI,,,2586541148
240,1209314426618359814,https://twitter.com/OgbanUgot/status/1209314426618359814,,"Some of my takes from the #AIDebate 1. The major problem with symbolic approaches seems to be search. 2. Also, what are symbols? How discrete should they be? There seems to be a lack of agreement on terminology on both sides.",2019-12-24 03:26:41,Tue Dec 24 03:26:41 +0000 2019,2,4,,#AIDebate,,,65780323
241,1209306118909906944,https://twitter.com/sourav_datta/status/1209306118909906944,,"#AIDebate I would argue that as a programmer not very familiar with the advanced math of DL, yet using it somewhat in practice, @GaryMarcus seemed more reasonable in his arguments about current state of DL in use. However, lots of new stuffs to learn and read now! Fun fun!",2019-12-24 02:53:41,Tue Dec 24 02:53:41 +0000 2019,3,18,@GaryMarcus,#AIDebate,,,36964025
242,1209305094971445249,https://twitter.com/kasia_kozdon/status/1209305094971445249,,"I'll need to rewatch some bits of the #AIDebate (it's after 2 am here) but a general thought for now: as a research community, we would benefit from clearer definitions that help to avoid strawmanning the other side of the argument. https:// twitter.com/GaryMarcus/sta tus/1209299647489085443 …",2019-12-24 02:49:37,Tue Dec 24 02:49:37 +0000 2019,0,5,,#AIDebate,,https://twitter.com/GaryMarcus/status/1209299647489085443,4690619832
243,1209303233405042691,https://twitter.com/davidrowley514/status/1209303233405042691,,"@GaryMarcus and Yoshua Bengio at #AIdebate with some of the 125 unanswered questions on the screen behind them. Lots of topics covered, misunderstandings clarified, and agreements found. Professors Marcus and Bengio agree on many issues, btw. pic.twitter.com/7eqxhlNgu6",2019-12-24 02:42:13,Tue Dec 24 02:42:13 +0000 2019,4,31,@GaryMarcus,#AIdebate,,,21680551
244,1209302683309531136,https://twitter.com/ShawnLillemo/status/1209302683309531136,,Just finished watching the #AIDebate between Yoshua Bengio and Gary Marcus. See A Consciousness Prior at https:// arxiv.org/pdf/1709.08568 .pdf … Both agreed that we are building something powerful and we should be focused on creating #responsibleai pic.twitter.com/w50ERSIT01,2019-12-24 02:40:02,Tue Dec 24 02:40:02 +0000 2019,12,29,,#AIDebate #responsibleai,,https://arxiv.org/pdf/1709.08568.pdf,1097554311549276160
245,1209300702054494209,https://twitter.com/CodeBug88/status/1209300702054494209,,"Gary Marcus is doing something very dishonest on every debate: equating *HIS* view (symbolic/nativism) with THE cog-science/psych view. Connectionist view IS A cog-science view too! Also, his take on child-dev is ONE view, there're connectionis views of child-dev too! #AIDebate",2019-12-24 02:32:09,Tue Dec 24 02:32:09 +0000 2019,3,20,,#AIDebate,,,171377151
246,1209299363081719808,https://twitter.com/WaleAkinfaderin/status/1209299363081719808,,The #AIDebate was pretty pointless. They both agree on the same thing most of the time unless when they want to talk about a paper they published in the 80s or 90s.,2019-12-24 02:26:50,Tue Dec 24 02:26:50 +0000 2019,0,0,,#AIDebate,,,237941903
247,1209298242657308672,https://twitter.com/CodeBug88/status/1209298242657308672,,The clear winner of the #AIDebate is the one that agreed more with my own views about AI before the debate started.,2019-12-24 02:22:23,Tue Dec 24 02:22:23 +0000 2019,0,1,,#AIDebate,,,171377151
248,1209297715471036416,https://twitter.com/amy_tabb/status/1209297715471036416,,"I planned on watching the #AIDebate , but by the time it came around, I was sick of the general Twitter fighting wrt AGI and besides I had started to learn a sai kata. The debate conflicted with my karate class; I chose the class. pic.twitter.com/rLEG7Adibk",2019-12-24 02:20:17,Tue Dec 24 02:20:17 +0000 2019,0,12,,#AIDebate,,,3243778719
249,1209297369256169472,https://twitter.com/AXTX/status/1209297369256169472,,#AIDebate https:// twitter.com/MelMitchell1/s tatus/1209277618219995136 …,2019-12-24 02:18:55,Tue Dec 24 02:18:55 +0000 2019,0,0,,#AIDebate,,https://twitter.com/MelMitchell1/status/1209277618219995136,47905449
250,1209296838588870656,https://twitter.com/sd_marlow/status/1209296838588870656,,"Having watched the #AIDebate , I can think of no good reason to keep AI and ML as part of the same science. Klingon poetry vs Vogon poetry.",2019-12-24 02:16:48,Tue Dec 24 02:16:48 +0000 2019,0,1,,#AIDebate,,,41087685
251,1209296749359239169,https://twitter.com/jm_alexia/status/1209296749359239169,,"I never expected to say this, but @GaryMarcus was the clear winner of the #AIDebate . He advocated for hybrid methods combining deep learning and symbolic AI and injecting stronger priors into AI models.",2019-12-24 02:16:27,Tue Dec 24 02:16:27 +0000 2019,25,189,@GaryMarcus,#AIDebate,,,839820726777544705
252,1209296002487853058,https://twitter.com/dlakalenda/status/1209296002487853058,,En vrai ça vaut pas non plus 1h de ton temps y'a les points les plus importants sur #AIDebate si jamais haha,2019-12-24 02:13:29,Tue Dec 24 02:13:29 +0000 2019,0,1,,#AIDebate,,,946385734285578240
253,1209290855074422784,https://twitter.com/KaiLashArul/status/1209290855074422784,,"There were plenty of interesting ideas floated at the #AIDebate , but unclear how much of a debate there was. Distributed variables with references, recursion, ... are ideas that have been around in neurosymbolic research for decades (even if we have new methods now).",2019-12-24 01:53:02,Tue Dec 24 01:53:02 +0000 2019,2,13,,#AIDebate,,,359956908
254,1209290836887965696,https://twitter.com/norveclibalikci/status/1209290836887965696,,"My take on #AIDebate , I think Marcus really down-scaled his voice as well as Bengio for the courtesy. They both agreed on each others' ideas. However, I am more on the side of @GaryMarcus . Why: (1/N)",2019-12-24 01:52:57,Tue Dec 24 01:52:57 +0000 2019,7,26,@GaryMarcus,#AIDebate,,,97442687
255,1209290675491090432,https://twitter.com/stenichele/status/1209290675491090432,,"I thought AI was more about understanding how the brain works & modeling it as best as we can (and not just making tools). Haven't heard a single time ""spiking neurons"" in the Bengio vs @GaryMarcus #AIDebate . What are brains made of? https:// twitter.com/stenichele/sta tus/1209288714343636993 …",2019-12-24 01:52:19,Tue Dec 24 01:52:19 +0000 2019,1,9,@GaryMarcus,#AIDebate,,https://twitter.com/stenichele/status/1209288714343636993,44132347
256,1209289958034460672,https://twitter.com/JesParent/status/1209289958034460672,,"#aidebate semi live-tweeting concludes now. I really appreciate the debate, so ty @ceobillionaire @Montreal_AI @GaryMarcus & Yoshua Bengio. Lots to look at from #NeurIPS2019 , and when the replay comes out, Bengio's AI / ML trajectories comments will help a lot for #frontiermap",2019-12-24 01:49:28,Tue Dec 24 01:49:28 +0000 2019,2,7,@ceobillionaire @Montreal_AI @GaryMarcus,#aidebate #NeurIPS2019 #frontiermap,,,929029531
257,1209289272290938880,https://twitter.com/ashah007/status/1209289272290938880,,Good to see #AIDebate had more agreeing points than disagreement. Interesting directions presented during the debate. All in all we are at least a decade away to achieve system 2 realizable intelligence.,2019-12-24 01:46:44,Tue Dec 24 01:46:44 +0000 2019,0,6,,#AIDebate,,,1974656552
258,1209288714343636993,https://twitter.com/stenichele/status/1209288714343636993,,"Pretty much useless #AIDebate . Very messy. Bengio:""the brain is a neural net all the way"". @GaryMarcus :""not the kind of DL neural nets we have now with many types of neurons/synapses/proteins etc"". Why wasting time with hybrid systems instead of researching better neural models? https:// twitter.com/stenichele/sta tus/1209251601464123392 …",2019-12-24 01:44:31,Tue Dec 24 01:44:31 +0000 2019,3,11,@GaryMarcus,#AIDebate,,https://twitter.com/stenichele/status/1209251601464123392,44132347
259,1209287595433308161,https://twitter.com/raamana_/status/1209287595433308161,,"This #AIDebate had been a bit mild for my [unrealistic] expectations :). Not enough punches :). I will think about few ways to spice it up for related future events :). That said, it's always very insightful to hear from experts like Yoshua and @GaryMarcus . #DeepLearning #AI pic.twitter.com/MqvGKDwzrx",2019-12-24 01:40:04,Tue Dec 24 01:40:04 +0000 2019,0,5,@GaryMarcus,#AIDebate #DeepLearning #AI,,,110940386
260,1209287172622356480,https://twitter.com/sd_marlow/status/1209287172622356480,,"#AIDebate The low-level ""it's all just gates and logic"" is likely the main reason I can't get behind ML as any kind of real path toward AGI.",2019-12-24 01:38:24,Tue Dec 24 01:38:24 +0000 2019,0,1,,#AIDebate,,,41087685
261,1209286758111707137,https://twitter.com/sourav_datta/status/1209286758111707137,,Bengio mostly countered most of Marcus's points via technical arguments and research works that may not still have production usage. Marcus's argument on the other hand seemed more targeted towards current hype v failure of DL/ML. So the actual debate didn't happen? #AIDebate,2019-12-24 01:36:45,Tue Dec 24 01:36:45 +0000 2019,3,12,,#AIDebate,,,36964025
262,1209286255441334273,https://twitter.com/halolimat/status/1209286255441334273,,"Unless we know how to build models that do generalize well, neither system (Symb or DL) is going to take a real step forward towards AGI. No rules or datasets can capture everything to be learned, so generalizability and adaptability are key! #AIDebate",2019-12-24 01:34:45,Tue Dec 24 01:34:45 +0000 2019,0,0,,#AIDebate,,,3918111748
263,1209286074192793602,https://twitter.com/gigasquid/status/1209286074192793602,,I would really love to have @MelMitchell1 participate in a future debate #AIDebate,2019-12-24 01:34:02,Tue Dec 24 01:34:02 +0000 2019,1,12,@MelMitchell1,#AIDebate,,,115557940
264,1209285864452448257,https://twitter.com/batssiki/status/1209285864452448257,,"Really interesting discussion about the power of decentralized learning, in the service of privacy AND in order to simulate how human social networks evolve! #AIDebate",2019-12-24 01:33:12,Tue Dec 24 01:33:12 +0000 2019,1,8,,#AIDebate,,,906228771467870208
265,1209285631991537670,https://twitter.com/gigasquid/status/1209285631991537670,,Thanks for the #AIDebate - It was a wonderful holiday present :),2019-12-24 01:32:16,Tue Dec 24 01:32:16 +0000 2019,2,7,,#AIDebate,,,115557940
266,1209285555369992192,https://twitter.com/JesParent/status/1209285555369992192,,#aidebate q&a Modularity / modulation 'the way in which the brain dynamically reconfigures itself' Bengio : that is deep learning Marcus: DL allows you to do this? Bengio: gates! Modern DL + gates,2019-12-24 01:31:58,Tue Dec 24 01:31:58 +0000 2019,2,10,,#aidebate,,,929029531
267,1209284463458308096,https://twitter.com/ImageSnippets/status/1209284463458308096,,great questions from twitter #AIDebate . Big problem in the debate seemed that there was not a good grounding in the vocabulary.,2019-12-24 01:27:38,Tue Dec 24 01:27:38 +0000 2019,1,10,,#AIDebate,,,1468517006
268,1209284093504053248,https://twitter.com/emy_aze/status/1209284093504053248,,"The clear #AIDebate winner was the lady who VERY condescendingly called the presenters ""you two geniuses"". Highlight of the debate.",2019-12-24 01:26:09,Tue Dec 24 01:26:09 +0000 2019,4,25,,#AIDebate,,,967810564083863562
269,1209284082854760448,https://twitter.com/hectorpal/status/1209284082854760448,,@GaryMarcus I was very surprised to listened to all these references to Cyc in the #aidebate . Maybe it’s because that’s about NL. Reasoning in AI moved on from Cyc’s techniques >25 years ago. Current theorem provers and probabilistic models are fundamentally different.,2019-12-24 01:26:07,Tue Dec 24 01:26:07 +0000 2019,1,7,@GaryMarcus,#aidebate,,,6394822
270,1209284021420773376,https://twitter.com/JesParent/status/1209284021420773376,,"#aidebate ""How to inject knowledge into DL networks"" & catastrophic forgetting . How will changes in the world / system affect updating? resilience? Marcus highlights the ""how to inject"" question for students to look at.",2019-12-24 01:25:52,Tue Dec 24 01:25:52 +0000 2019,3,6,,#aidebate,,,929029531
271,1209283302089097218,https://twitter.com/MelMitchell1/status/1209283302089097218,,"Vis a vis the Marcus / Bengio #AIDebate , I just don't buy the implied strict separation between ""System 1"" and ""System 2"".",2019-12-24 01:23:01,Tue Dec 24 01:23:01 +0000 2019,17,112,,#AIDebate,,,367297219
272,1209282900677533696,https://twitter.com/JesParent/status/1209282900677533696,,"#aidebate boltzman machines and ""80s AI"" What if they include indirection?",2019-12-24 01:21:25,Tue Dec 24 01:21:25 +0000 2019,0,0,,#aidebate,,,929029531
273,1209282384799113216,https://twitter.com/JesParent/status/1209282384799113216,,#aidebate Bengio on some past-present models: 'reasoning as finding a configuration of random variables that is most compatible with what you already know' unconscious reasoning: energy minimization? Two kinds of reasoning. pic.twitter.com/pA33Wsa4H4,2019-12-24 01:19:22,Tue Dec 24 01:19:22 +0000 2019,1,3,,#aidebate,,,929029531
274,1209282311490916352,https://twitter.com/AlanMorrison/status/1209282311490916352,,"#AIDebate re @GaryMarcus mentioning Josh Tenenbaum and research and hybrids... See https:// arxiv.org/abs/1905.12389 , for example https:// twitter.com/GaryMarcus/sta tus/1201302004431147008 …",2019-12-24 01:19:05,Tue Dec 24 01:19:05 +0000 2019,4,13,@GaryMarcus,#AIDebate,,"https://arxiv.org/abs/1905.12389,https://twitter.com/GaryMarcus/status/1201302004431147008",7005092
275,1209282089616629761,https://twitter.com/Turing2014/status/1209282089616629761,,Beyond #semantics (meaning of words) #intelligent #machines require #pragmatics - #NaturalLanguage usage #AIDebate @GaryMarcus https:// twitter.com/JesParent/stat us/1209281109395148800 …,2019-12-24 01:18:12,Tue Dec 24 01:18:12 +0000 2019,0,2,@GaryMarcus,#semantics #intelligent #machines #pragmatics #NaturalLanguage #AIDebate,,https://twitter.com/JesParent/status/1209281109395148800,56082427
276,1209281930295939072,https://twitter.com/raamana_/status/1209281930295939072,,"Yoshua said it a few times in #AIdebate that ""transformers work really well!"" It doesn't appear so to me when trying one such instance at http:// talktotransformer.com h/t @GaryMarcus #MachineLearning #DeepLearning pic.twitter.com/HhTz3kyzUa",2019-12-24 01:17:34,Tue Dec 24 01:17:34 +0000 2019,7,9,@GaryMarcus,#AIdebate #MachineLearning #DeepLearning,,http://talktotransformer.com,110940386
277,1209281591782100992,https://twitter.com/JesParent/status/1209281591782100992,,"#aidebate more on language & intelligence q @GaryMarcus language and reason are separate things in the brain -- but not completely separate. Having the world model is a prereq for advanced language, but it's very hard.",2019-12-24 01:16:13,Tue Dec 24 01:16:13 +0000 2019,1,2,@GaryMarcus,#aidebate,,,929029531
278,1209281109395148800,https://twitter.com/JesParent/status/1209281109395148800,,"#aidebate q&a - language understanding as a form of intelligence? Language has syntax and structure, but semantic use refers to how the world works. (""Common Sense""). If we don't have connection to the world, we won't understand how language works. System1-System2 links?",2019-12-24 01:14:18,Tue Dec 24 01:14:18 +0000 2019,0,2,,#aidebate,,,929029531
279,1209280885276717056,https://twitter.com/MichaelPayton67/status/1209280885276717056,,Right I wasn’t saying these words haven’t been used before but clearly they need to be clarified in light of these arguments. I’m not sure how much Ferdinand de Saussure would contribute to the #AIDebate but I’m all ears...,2019-12-24 01:13:25,Tue Dec 24 01:13:25 +0000 2019,0,0,,#AIDebate,,,304578582
280,1209280833057484801,https://twitter.com/JazBerri/status/1209280833057484801,,Also viewing it from @rhyolight 's Twitch stream for the commentary. Valid points were made that not enough science was mentioned. #AIDebate,2019-12-24 01:13:12,Tue Dec 24 01:13:12 +0000 2019,0,4,@rhyolight,#AIDebate,,,146304997
281,1209280210773954560,https://twitter.com/JesParent/status/1209280210773954560,,#aidebate can AI possessing self consciousness ? Bengio: we don't really know right now.,2019-12-24 01:10:44,Tue Dec 24 01:10:44 +0000 2019,0,0,,#aidebate,,,929029531
282,1209279696627736578,https://twitter.com/raamana_/status/1209279696627736578,,"Questions for #AIDebate : 1) when will we stop debating people, and start establishing consensus on terminology? 2) what concrete actions have you done in the last few years to reduce unsubstantiated hype related to #AI and #deeplearning ? Thanks. #MachineLearning",2019-12-24 01:08:41,Tue Dec 24 01:08:41 +0000 2019,12,31,,#AIDebate #AI #deeplearning #MachineLearning,,,110940386
283,1209279572891643905,https://twitter.com/emy_aze/status/1209279572891643905,,"Q: how do we make sure ai doesn't increase human suffering? Marcus : ""we need to fix our biases at data aquisition"" Bengio : ""thats the governments problem"" #AIDebate",2019-12-24 01:08:12,Tue Dec 24 01:08:12 +0000 2019,0,21,,#AIDebate,,,967810564083863562
284,1209279315617222657,https://twitter.com/UsmanSattarMD/status/1209279315617222657,,Finally! Great question and response on #AI #ethics & #regulation on #AIDebate,2019-12-24 01:07:10,Tue Dec 24 01:07:10 +0000 2019,4,3,,#AI #ethics #regulation #AIDebate,,,320946636
285,1209279211611054081,https://twitter.com/JesParent/status/1209279211611054081,,"#aidebate ethics q continued: Both Marcus and Bengio are concerned about speed of dev & lack of regulation. Mention of @BanKillerRobots , and that slowing down dev may be a good idea. Encourages people to continue to voice their concerns #aiethics",2019-12-24 01:06:46,Tue Dec 24 01:06:46 +0000 2019,1,4,@BanKillerRobots,#aidebate #aiethics,,,929029531
286,1209279209706835969,https://twitter.com/JesParent/status/1209279209706835969,,#aidebate HARDCORE ethics q abt lack of talk about checks and balances and #aisafety and #aiethics in this discussion. Marcus steps in to defend Bengio for being very much on the best side of this question as possible.,2019-12-24 01:06:45,Tue Dec 24 01:06:45 +0000 2019,2,3,,#aidebate #aisafety #aiethics,,,929029531
287,1209278420649164800,https://twitter.com/JesParent/status/1209278420649164800,,#aidebate quantum computing question - Bengio - computer science and neuroscience seems to be betting that quantum isn't necessarily. But maybe QC could change the game - unknown unknowns,2019-12-24 01:03:37,Tue Dec 24 01:03:37 +0000 2019,0,2,,#aidebate,,,929029531
288,1209278291049205760,https://twitter.com/prem_k/status/1209278291049205760,,Wish I could see the #AIDebate live. It requires the Facebook app to be installed and won't show the video on Chrome.,2019-12-24 01:03:06,Tue Dec 24 01:03:06 +0000 2019,0,2,,#AIDebate,,,34394575
289,1209277618219995136,https://twitter.com/MelMitchell1/status/1209277618219995136,,#AIDebate https:// twitter.com/MelMitchell1/s tatus/1209277388145618944 …,2019-12-24 01:00:26,Tue Dec 24 01:00:26 +0000 2019,0,6,,#AIDebate,,https://twitter.com/MelMitchell1/status/1209277388145618944,367297219
290,1209276656684167168,https://twitter.com/rhyolight/status/1209276656684167168,,Both are taking Q&A now #AIDebate pic.twitter.com/90Ziez2SLu,2019-12-24 00:56:36,Tue Dec 24 00:56:36 +0000 2019,0,2,,#AIDebate,,,6797182
291,1209276161697693697,https://twitter.com/JesParent/status/1209276161697693697,,"#aidebate ""small data regimes"" comes up in talk about older views that 'more data will solve everything' Do you have experience elsewhere that you can leverage? Depends on various things / disagreements about this.",2019-12-24 00:54:38,Tue Dec 24 00:54:38 +0000 2019,0,1,,#aidebate,,,929029531
292,1209276077614489601,https://twitter.com/emy_aze/status/1209276077614489601,,Did Marcus quote a 90s paper just to flex on Bengio ? #AIDebate,2019-12-24 00:54:18,Tue Dec 24 00:54:18 +0000 2019,1,3,,#AIDebate,,,967810564083863562
293,1209275385814368257,https://twitter.com/batssiki/status/1209275385814368257,,"Sidenote: He's working on the carbon footprint of training algorithms, something we all need to think more about! @AINowInstitute #AIDebate",2019-12-24 00:51:33,Tue Dec 24 00:51:33 +0000 2019,0,2,@AINowInstitute,#AIDebate,,,906228771467870208
294,1209275213105520640,https://twitter.com/WaleAkinfaderin/status/1209275213105520640,,"Gary to Yoshua: ""I find it harder and harder to disagree with you."" I don't like this attempt at ""famzing"". #AIDebate",2019-12-24 00:50:52,Tue Dec 24 00:50:52 +0000 2019,0,5,,#AIDebate,,,237941903
295,1209274664092131328,https://twitter.com/kairosdojo/status/1209274664092131328,,"Gary Marcus: ""I find it harder and harder to disagree with you"". Yoshua Bengio: ""Well, I disagree with you"". #AIDebate",2019-12-24 00:48:41,Tue Dec 24 00:48:41 +0000 2019,0,3,,#AIDebate,,,807902569758593024
296,1209274654042599424,https://twitter.com/JesParent/status/1209274654042599424,,"#aidebate ethics question! for Bengio. Remarked that we aren't ready to talk about Personhood yet. Personal thought: I really wonder what Norbert Wiener would say if he were present at this debate, about everything and ethics in specific #aiethics #ethicsofai",2019-12-24 00:48:39,Tue Dec 24 00:48:39 +0000 2019,0,1,,#aidebate #aiethics #ethicsofai,,,929029531
297,1209274626142027777,https://twitter.com/WaleAkinfaderin/status/1209274626142027777,,"Finally, a question about ethical implications of AI systems. #AIDebate",2019-12-24 00:48:32,Tue Dec 24 00:48:32 +0000 2019,0,1,,#AIDebate,,,237941903
298,1209274487981707264,https://twitter.com/nikogrupen/status/1209274487981707264,,Love to see @jeffclune ‘s AI-GAs work getting a shoutout at #AIDebate,2019-12-24 00:47:59,Tue Dec 24 00:47:59 +0000 2019,0,3,@jeffclune,#AIDebate,,,147615935
299,1209273981288812544,https://twitter.com/AngeloDalli/status/1209273981288812544,,Bengio’s version of Occam’s razor: Consistent generative future AI systems should *start off with the least number of priors* — would these minimal priors be the start of a causal graph that can handle most common sense situations? Do @ylecun findings hold? #AIDebate @yudapearl pic.twitter.com/9BMLQcRxBz,2019-12-24 00:45:59,Tue Dec 24 00:45:59 +0000 2019,0,5,@ylecun @yudapearl,#AIDebate,,,22894187
300,1209273947889504256,https://twitter.com/hameliknaoh/status/1209273947889504256,,"Gary to Yoshua: ""I find it harder and harder to disagree with you."" #AIDebate : We are done for tonight!",2019-12-24 00:45:51,Tue Dec 24 00:45:51 +0000 2019,2,13,,#AIDebate,,,1150501570678800384
301,1209273736014311427,https://twitter.com/sd_marlow/status/1209273736014311427,,#AIDebate So... I guess words and definitions are going to be THE divide between GOFAI and ML.,2019-12-24 00:45:00,Tue Dec 24 00:45:00 +0000 2019,0,6,,#AIDebate,,,41087685
302,1209273647199854593,https://twitter.com/MichaelPayton67/status/1209273647199854593,,Free work for philosophers: help researchers define “amount of innateness” “symbols” and “learnablity” #AIDebate,2019-12-24 00:44:39,Tue Dec 24 00:44:39 +0000 2019,1,17,,#AIDebate,,,304578582
303,1209273589104549893,https://twitter.com/danielhaehn/status/1209273589104549893,,"""You are more symbolic than me"" @GaryMarcus to #YoshuaBengio in the #AIDebate",2019-12-24 00:44:25,Tue Dec 24 00:44:25 +0000 2019,2,7,@GaryMarcus,#YoshuaBengio #AIDebate,,,463866998
304,1209273543269199872,https://twitter.com/emy_aze/status/1209273543269199872,,Encore avec les 90s!! #AIDebate,2019-12-24 00:44:14,Tue Dec 24 00:44:14 +0000 2019,0,2,,#AIDebate,,,967810564083863562
305,1209273534033231872,https://twitter.com/GretchenMarina/status/1209273534033231872,,Need a little diversion mid- #AIDebate ? Check out #AIDungeon :) https:// aidungeon.io /,2019-12-24 00:44:12,Tue Dec 24 00:44:12 +0000 2019,0,2,,#AIDebate #AIDungeon,,https://aidungeon.io/,991126215049261057
306,1209273465762721792,https://twitter.com/rgblong/status/1209273465762721792,,This paper by @TonyZador is very relevant to the @GaryMarcus /Bengio #AIDebate going on right now https://www. nature.com/articles/s4146 7-019-11786-6 …,2019-12-24 00:43:56,Tue Dec 24 00:43:56 +0000 2019,1,12,@TonyZador @GaryMarcus,#AIDebate,,https://www.nature.com/articles/s41467-019-11786-6,1247652517
307,1209273217669570560,https://twitter.com/JesParent/status/1209273217669570560,,#aidebate : the reason you need references is to know where the values come from - Bengio,2019-12-24 00:42:56,Tue Dec 24 00:42:56 +0000 2019,1,2,,#aidebate,,,929029531
