,ID,permalink,username,text,date,formatted_date,retweets,favorites,mentions,hashtags,geo,urls,author_id
176,1209650450183667714,https://twitter.com/PeaceConcern/status/1209650450183667714,,Please follow @peaceconcern for a better #Peace ful community RT @paaatcha : @GaryMarcus The #AIDebate has become #AIWar lol just kidding #peace,2019-12-25 01:41:56,Wed Dec 25 01:41:56 +0000 2019,0,0,@peaceconcern @paaatcha @GaryMarcus,#Peace #AIDebate #AIWar #peace,,,806236719636946944
177,1209649829384794112,https://twitter.com/paaatcha/status/1209649829384794112,,The #AIDebate has become #AIWar lol just kidding #peace,2019-12-25 01:39:28,Wed Dec 25 01:39:28 +0000 2019,0,4,,#AIDebate #AIWar #peace,,,158166637
178,1209647133118255105,https://twitter.com/adelegoldberg1/status/1209647133118255105,,"System 1: automatic, fast, unconscious, implicit System 2: effortful, slow, conscious, explicit which is language? #AIDebate 1/3",2019-12-25 01:28:45,Wed Dec 25 01:28:45 +0000 2019,7,47,,#AIDebate,,,871372298477023232
179,1209645200144027649,https://twitter.com/Montreal_AI/status/1209645200144027649,,Thank you so much Hessam for your great support #AIDebate,2019-12-25 01:21:04,Wed Dec 25 01:21:04 +0000 2019,0,2,,#AIDebate,,,919860212
180,1209640096900812800,https://twitter.com/GaryMarcus/status/1209640096900812800,,"four questions for the deep learning community: 1. How would you define deep learning? 2. What if anything are you committed to? 3. What if anything would you say would not count as deep learning? 4. What is the significance of the word ""deep"", in your definition? #AIDebate https:// twitter.com/raamana_/statu s/1209266195678973952 …",2019-12-25 01:00:47,Wed Dec 25 01:00:47 +0000 2019,48,162,,#AIDebate,,https://twitter.com/raamana_/status/1209266195678973952,232294292
181,1209637795884462080,https://twitter.com/eShailendra/status/1209637795884462080,,Slides of both @GaryMarcus and Yoshua Bengio for the #AIDebate . Courtesy @Montreal_AI #AI #DL #ML #artificialIntelligence #Machinelearning #symbolicAI #connectionism #Deeplearning https:// twitter.com/Montreal_AI/st atus/1209502278685732865 …,2019-12-25 00:51:39,Wed Dec 25 00:51:39 +0000 2019,4,7,@GaryMarcus @Montreal_AI,#AIDebate #AI #DL #ML #artificialIntelligence #Machinelearning #symbolicAI #connectionism #Deeplearning,,https://twitter.com/Montreal_AI/status/1209502278685732865,61085452
182,1209630803212279808,https://twitter.com/subjectcentric/status/1209630803212279808,,Watching #AIdebate between Yoshua Bengio & Gary Marcus: I think we will face very different AI systems produced by ‘neural networks only’ and hybrid approaches in short-mid term,2019-12-25 00:23:51,Wed Dec 25 00:23:51 +0000 2019,0,1,,#AIdebate,,,172142274
183,1209621427491606529,https://twitter.com/RudraPoudel/status/1209621427491606529,,"@GaryMarcus honestly after #AIDebate I dont see the difference, Variable = input to a fn. Operation = approximated by a fn/gating. Discrete variable = sampling from distribution approx. again by a fn. Where, fn = Neural Network or ... Am I missing anything? Where is the diff?",2019-12-24 23:46:36,Tue Dec 24 23:46:36 +0000 2019,0,0,@GaryMarcus,#AIDebate,,,279973583
184,1209600412946501632,https://twitter.com/kylemockeridge/status/1209600412946501632,,Right now there's an AI at google that's looking at me pick my nose through my webcam probably. Just think about that the next time you watch pornhub. #riseofthemachines #AIDebate,2019-12-24 22:23:06,Tue Dec 24 22:23:06 +0000 2019,0,0,,#riseofthemachines #AIDebate,,,861314094179258369
185,1209595205864886274,https://twitter.com/hessam_amini/status/1209595205864886274,,Thank you @Montreal_AI for organizing the amazing #AIDebate ! pic.twitter.com/MnkBPcWj5m,2019-12-24 22:02:24,Tue Dec 24 22:02:24 +0000 2019,3,7,@Montreal_AI,#AIDebate,,,1182646682900676609
186,1209586662684143616,https://twitter.com/Montreal_AI/status/1209586662684143616,,"The 5,000th person to sign up for the AI debate ... ... and winner of a free signed copy by of http:// Rebooting.AI is Bahram Yoosefizonooz ! #AIDebate #MontrealAI pic.twitter.com/zsWNrzAjpB",2019-12-24 21:28:28,Tue Dec 24 21:28:28 +0000 2019,3,8,,#AIDebate #MontrealAI,,http://Rebooting.AI,919860212
187,1209582355960205312,https://twitter.com/Synced_Global/status/1209582355960205312,,"In case you missed the #AIDebate last night between Yoshua Bengio and Gary Marcus, here is the recording: http:// bit.ly/377Vfvj #ArtificialIntelliegnce pic.twitter.com/ta47rIVnww",2019-12-24 21:11:21,Tue Dec 24 21:11:21 +0000 2019,5,9,,#AIDebate #ArtificialIntelliegnce,,http://bit.ly/377Vfvj,819861340294524928
188,1209581157253206018,https://twitter.com/VidaVakil/status/1209581157253206018,,"My thoughts on yesterday’s #AIDebate , and what Deep Learning stands for https:// twitter.com/vidavakil/stat us/1209564322021572608 …",2019-12-24 21:06:35,Tue Dec 24 21:06:35 +0000 2019,0,2,,#AIDebate,,https://twitter.com/vidavakil/status/1209564322021572608,373083685
189,1209548639003037696,https://twitter.com/AlanMorrison/status/1209548639003037696,,"But also rigid. Some DLers (Flat Data Society) will only watch the British Baking Show and insist on white flour, while some symbolists swear by whole kernel rye or pumpernickel. I'm in the latter camp. Give me data with context, please. More context! Am I wrong? #AIDebate",2019-12-24 18:57:22,Tue Dec 24 18:57:22 +0000 2019,1,4,,#AIDebate,,,7005092
190,1209548523596918786,https://twitter.com/raamana_/status/1209548523596918786,,"I also agree with @GaryMarcus here: https:// twitter.com/GaryMarcus/sta tus/1209538580688900097?s=20 … Claiming it is DL when it succeeds, and moving the goal post around when it fails or criticized, makes #AIDebate intractable.",2019-12-24 18:56:55,Tue Dec 24 18:56:55 +0000 2019,2,9,@GaryMarcus,#AIDebate,,https://twitter.com/GaryMarcus/status/1209538580688900097?s=20,110940386
191,1209533063207649280,https://twitter.com/AlanMorrison/status/1209533063207649280,,"Other ""alt-brand"" terms in #AIDebate incl. these: (1) ""data"" (which might or might not include ""symbolic"" KR metadata such as RDF/OWL) (2) ""richness"" (Bengio implied symbolic couldn't be rich--depends on what you mean by ""rich"") (3) ""symbolic"" (static 1980s, or evolved 2010s?)",2019-12-24 17:55:28,Tue Dec 24 17:55:28 +0000 2019,1,7,,#AIDebate,,,7005092
192,1209529280545165312,https://twitter.com/ImageSnippets/status/1209529280545165312,,Good summaryof the #AIDebate https:// twitter.com/TiernanRayTech /status/1209463109653544960 …,2019-12-24 17:40:27,Tue Dec 24 17:40:27 +0000 2019,2,4,,#AIDebate,,https://twitter.com/TiernanRayTech/status/1209463109653544960,1468517006
193,1209527769677172736,https://twitter.com/_MichaelZink/status/1209527769677172736,,Excellent summary of yesterday’s #AIDebate https:// twitter.com/TiernanRayTech /status/1209463109653544960 …,2019-12-24 17:34:26,Tue Dec 24 17:34:26 +0000 2019,0,4,,#AIDebate,,https://twitter.com/TiernanRayTech/status/1209463109653544960,966039620415717377
194,1209526521922293760,https://twitter.com/kidehen/status/1209526521922293760,,#AIDebate #AI #Debate #ML #DeepLearning #CognitiveScience #Language #Logic https:// twitter.com/rhyolight/stat us/1209497496650600448 …,2019-12-24 17:29:29,Tue Dec 24 17:29:29 +0000 2019,0,3,,#AIDebate #AI #Debate #ML #DeepLearning #CognitiveScience #Language #Logic,,https://twitter.com/rhyolight/status/1209497496650600448,1294621
195,1209518401892343815,https://twitter.com/raamana_/status/1209518401892343815,,"I’m not sure how my comment came across as an attack. I was following the #AIdebate with an open mind and trying to learn from both sides, and this overly general rebranding did come across as changing the goal post. That’s also why I call for consensus: https:// twitter.com/raamana_/statu s/1209279696627736578?s=20 …",2019-12-24 16:57:13,Tue Dec 24 16:57:13 +0000 2019,0,4,,#AIdebate,,https://twitter.com/raamana_/status/1209279696627736578?s=20,110940386
196,1209510888111104000,https://twitter.com/punkstrategy/status/1209510888111104000,,This is maybe the most important thing that was said at the #AIDebate yesterday pic.twitter.com/rR8QlR4pMK,2019-12-24 16:27:22,Tue Dec 24 16:27:22 +0000 2019,2,5,,#AIDebate,,,17145553
197,1209504949333307399,https://twitter.com/stenichele/status/1209504949333307399,,Are you thinking of anyone in particular when you say some folks seem confused about what DL is? I assume you have been watching the #AIDebate between Youshua Bengio and @GaryMarcus . Some folks even think DL is MLPs!,2019-12-24 16:03:46,Tue Dec 24 16:03:46 +0000 2019,0,8,@GaryMarcus,#AIDebate,,,44132347
198,1209503371381661699,https://twitter.com/Montreal_AI/status/1209503371381661699,,Winner of the #AIDebate ?,2019-12-24 15:57:29,Tue Dec 24 15:57:29 +0000 2019,5,6,,#AIDebate,,,919860212
199,1209502278685732865,https://twitter.com/Montreal_AI/status/1209502278685732865,,AI DEBATE : Yoshua Bengio | Gary Marcus Slides by Yoshua & Gary : https:// montrealartificialintelligence.com/aidebate/ #AIDebate #MontrealAI pic.twitter.com/vcGf11dH48,2019-12-24 15:53:09,Tue Dec 24 15:53:09 +0000 2019,4,9,,#AIDebate #MontrealAI,,https://montrealartificialintelligence.com/aidebate/,919860212
200,1209498712617046016,https://twitter.com/swarnasras/status/1209498712617046016,,Can we predict the winners of the #AIDebate on Twitter based on whether we need symbolic ai hybrids or neural networks to do the prediction? @GaryMarcus,2019-12-24 15:38:59,Tue Dec 24 15:38:59 +0000 2019,2,3,@GaryMarcus,#AIDebate,,,14659469
201,1209497496650600448,https://twitter.com/rhyolight/status/1209497496650600448,,"If you missed the #AIDebate between @GaryMarcus and Yoshua Bengio yesterday, catch up with what my audience and I said about it (and how we scored the debaters). https://www. youtube.com/watch?v=aQQrpG 3VJOk …",2019-12-24 15:34:09,Tue Dec 24 15:34:09 +0000 2019,0,2,@GaryMarcus,#AIDebate,,https://www.youtube.com/watch?v=aQQrpG3VJOk,6797182
202,1209496544543682563,https://twitter.com/UsmanSattarMD/status/1209496544543682563,,#artificialintelliegnce Is Rushing Into #PatientCare - And Could Raise Risks #AI systems aren't as rigorously tested as other #Medicaldevices & have already made serious mistakes @GaryMarcus Just extrapolating from yesterday's #AIDebate --> #healthcare https://www. scientificamerican.com/article/artifi cial-intelligence-is-rushing-into-patient-care-and-could-raise-risks/?amp;text= …,2019-12-24 15:30:22,Tue Dec 24 15:30:22 +0000 2019,0,0,@GaryMarcus,#artificialintelliegnce #PatientCare #AI #Medicaldevices #AIDebate #healthcare,,https://www.scientificamerican.com/article/artificial-intelligence-is-rushing-into-patient-care-and-could-raise-risks/?amp;text=,320946636
203,1209495244871352322,https://twitter.com/swarnasras/status/1209495244871352322,,The run up to the #AIDebate and the debate itself was good fun. @dileeplearning Good to see you feature on the debate with @GaryMarcus ! So what’s the verdict? Are you changing your twitter handle?,2019-12-24 15:25:12,Tue Dec 24 15:25:12 +0000 2019,0,1,@dileeplearning @GaryMarcus,#AIDebate,,,14659469
204,1209493539895349249,https://twitter.com/seanmcarroll/status/1209493539895349249,,"A debate between two approaches to A.I.: symbolism (emphasize high-level concepts) and connectionism (pour in data and sift for patterns). Modern deep learning tilts toward the latter. Both participants favor a hybrid, with different emphases. #aidebate https:// twitter.com/TiernanRayTech /status/1209463109653544960 …",2019-12-24 15:18:25,Tue Dec 24 15:18:25 +0000 2019,16,82,,#aidebate,,https://twitter.com/TiernanRayTech/status/1209463109653544960,21611239
205,1209493272285966336,https://twitter.com/rhyolight/status/1209493272285966336,,Both @GaryMarcus and Yoshua agreed on a lot in their #AIDebate last night. But Yoshua says Gary's symbolic subfield of AI also needs a REBOOT!! (I tend to agree) https://www. twitch.tv/rhyolight_/cli p/TacitStormyTruffleTheThing …,2019-12-24 15:17:22,Tue Dec 24 15:17:22 +0000 2019,1,2,@GaryMarcus,#AIDebate,,https://www.twitch.tv/rhyolight_/clip/TacitStormyTruffleTheThing,6797182
206,1209492272187768832,https://twitter.com/swarnasras/status/1209492272187768832,,@GaryMarcus had an edge during round 2 of the #AIDebate with this slide running on the background! It was nice how the format evolved spontaneously. pic.twitter.com/XIMHfwF4Vh,2019-12-24 15:13:23,Tue Dec 24 15:13:23 +0000 2019,2,5,@GaryMarcus,#AIDebate,,,14659469
207,1209491698914660352,https://twitter.com/KordoniN/status/1209491698914660352,,"An historic debate between two of the artificial intelligence illuminati was mostly simpatico on the big questions, but it was also punctuated by sharp differences on some of the details. By Tiernan Ray : https:// lnkd.in/e7_D-Bg #AIDebate #MontrealAI",2019-12-24 15:11:06,Tue Dec 24 15:11:06 +0000 2019,7,9,,#AIDebate #MontrealAI,,https://lnkd.in/e7_D-Bg,1162613760068136960
208,1209487704280510464,https://twitter.com/mirco_ravanelli/status/1209487704280510464,,"Yesterday I saw the #AIdebate . My feeling is that Yoshua is looking forward, trying to extend #deepLearning with higher-level capabilities (e.g, causality), while @GaryMarcus is looking backward trying to combine it with the same techniques that didn't work so well in the past!",2019-12-24 14:55:14,Tue Dec 24 14:55:14 +0000 2019,8,32,@GaryMarcus,#AIdebate #deepLearning,,,943867671061417984
209,1209487661779554306,https://twitter.com/UsmanSattarMD/status/1209487661779554306,,"Historic #AIDebate between two of the #artificialintelligence illuminati was mostly simpatico on big questions -- creating hybrid #AI systems, finding right ""priors"" for knowledge -- but it was also punctuated by sharp differences @GaryMarcus @Montreal_AI https://www. zdnet.com/article/devils -in-the-details-in-bengio-marcus-ai-debate/ …",2019-12-24 14:55:04,Tue Dec 24 14:55:04 +0000 2019,3,9,@GaryMarcus @Montreal_AI,#AIDebate #artificialintelligence #AI,,https://www.zdnet.com/article/devils-in-the-details-in-bengio-marcus-ai-debate/,320946636
210,1209484703218184192,https://twitter.com/stenichele/status/1209484703218184192,,This is exactly the claim of Bengio. He acknowledges that our brain is able manipulate symbols. However this is done/implemented by (spiking) neurons. #AIDebate,2019-12-24 14:43:19,Tue Dec 24 14:43:19 +0000 2019,0,0,,#AIDebate,,,44132347
211,1209483626204803072,https://twitter.com/stenichele/status/1209483626204803072,,"Critical question for @GaryMarcus : ""what kind of NN is the brain?""->claim: symbolic/hybrid at algorithmic level, neural implementation. Why focus on building abstract (narrow) symbolic/hybrid approximation instead of implementig the ""algorithms"" in neural substrates? #AIDebate pic.twitter.com/3Ah8YPaym5",2019-12-24 14:39:02,Tue Dec 24 14:39:02 +0000 2019,1,2,@GaryMarcus,#AIDebate,,,44132347
212,1209480732118331392,https://twitter.com/stenichele/status/1209480732118331392,,Shocking to hear @GaryMarcus claiming that DL is basically a MLP you've got quite some literature to cover from 1980s to 2019!! #AIDebate pic.twitter.com/wLQz7glehR,2019-12-24 14:27:32,Tue Dec 24 14:27:32 +0000 2019,0,4,@GaryMarcus,#AIDebate,,,44132347
213,1209476232930160641,https://twitter.com/VictorStorchan/status/1209476232930160641,,"#ToWatch Débat passionnant entre Yoshua Bengio et @GaryMarcus sur la meilleure voie à suivre pour l' #IA . On y parle histoire récente de l'IA, de méthodes hybrides (Deep Learning et Symbolic AI) ou encore de #responsibleAI . #AIDebate @Montreal_AI https://www. youtube.com/watch?v=pKgsea ENkAU&feature=youtu.be …",2019-12-24 14:09:39,Tue Dec 24 14:09:39 +0000 2019,7,11,@GaryMarcus @Montreal_AI,#ToWatch #IA #responsibleAI #AIDebate,,https://www.youtube.com/watch?v=pKgseaENkAU&feature=youtu.be,4085761879
214,1209472954448465921,https://twitter.com/tkashpm/status/1209472954448465921,,"The classic ""Trolley-Problem"" comes back to haunt us! @medialab researchers testing their ""Moral Machine"" to imply that ethics that could be applied to AI decision making, depend heavily on cultural factors. #Product #AI #AIDebate #ethics #MIT https:// twitter.com/techreview/sta tus/1209467243270213632 …",2019-12-24 13:56:37,Tue Dec 24 13:56:37 +0000 2019,0,0,@medialab,#Product #AI #AIDebate #ethics #MIT,,https://twitter.com/techreview/status/1209467243270213632,1112075557255172098
215,1209465908697034753,https://twitter.com/eShailendra/status/1209465908697034753,,"I am still wrapping around the concepts as I come from a non-AI background. Are your slides (both your's and Yoshua's) shared somewhere for a recap? I loved the debate, I tried to follow the reading list but found many concepts out of my range. Need further re-reads. #AIDebate",2019-12-24 13:28:38,Tue Dec 24 13:28:38 +0000 2019,0,2,,#AIDebate,,,61085452
216,1209464717879783425,https://twitter.com/raamana_/status/1209464717879783425,,"I think @SiliconHBO can have an entire episode/season, on the power and limits of #DeepLearning , making caricatures of all the key scientists and corporate t̶h̶o̶u̶g̶h̶t̶ hype leaders. They don't even need to write a script. It's all here on twitter. #AIDebate @GaryMarcus #AI",2019-12-24 13:23:54,Tue Dec 24 13:23:54 +0000 2019,2,8,@SiliconHBO @GaryMarcus,#DeepLearning #AIDebate #AI,,,110940386
217,1209463109653544960,https://twitter.com/TiernanRayTech/status/1209463109653544960,,AI scholars debated the nuances Monday night — here’s a wrap-up: Devil’s in the details in Historic AI debate | ZDNet // ⁦ @GaryMarcus ⁩ ⁦ @MILAMontreal ⁩ // #AI #ArtificialIntelligence #DeepLearning #AIDebate https://www. zdnet.com/article/devils -in-the-details-in-bengio-marcus-ai-debate/ …,2019-12-24 13:17:30,Tue Dec 24 13:17:30 +0000 2019,41,95,@GaryMarcus @MILAMontreal,#AI #ArtificialIntelligence #DeepLearning #AIDebate,,https://www.zdnet.com/article/devils-in-the-details-in-bengio-marcus-ai-debate/,216798259
218,1209447267884830720,https://twitter.com/IntuitMachine/status/1209447267884830720,,In the recently concluded #AIDebate Bengio argues for the value of references. Names or references are essential for Pi-Calculus because they are the primitives of coordination. https://www. facebook.com/MontrealAI/vid eos/498403850881660/ …,2019-12-24 12:14:33,Tue Dec 24 12:14:33 +0000 2019,3,11,,#AIDebate,,https://www.facebook.com/MontrealAI/videos/498403850881660/,3027431134
219,1209445710212395008,https://twitter.com/csabaveres/status/1209445710212395008,,"Gary Marcus lost the debate by insisting that the two views were converging. It is clear that Bengio does not like the idea of hybrid systems, whatever those might be. Marcus was like a boxer who kept screaming “we’re not really fighting” #AIDebate",2019-12-24 12:08:22,Tue Dec 24 12:08:22 +0000 2019,1,4,,#AIDebate,,,92597791
220,1209430443860398081,https://twitter.com/techforgoodtv/status/1209430443860398081,,Check out the @DigitalAgenda_ #TechForGood podcast! This week they explore their hopes and fears for #AI #AIDebate https:// digitalagenda.io/summit/#podcast,2019-12-24 11:07:42,Tue Dec 24 11:07:42 +0000 2019,2,2,@DigitalAgenda_,#TechForGood #AI #AIDebate #podcast,,https://digitalagenda.io/summit/#podcast,2769925698
221,1209411876142157825,https://twitter.com/BadisaMosne/status/1209411876142157825,,#AIDebate https:// twitter.com/BennieMols/sta tus/1209397881473585152 …,2019-12-24 09:53:55,Tue Dec 24 09:53:55 +0000 2019,2,3,,#AIDebate,,https://twitter.com/BennieMols/status/1209397881473585152,900436693
222,1209410354997944320,https://twitter.com/DanielePellicc8/status/1209410354997944320,,"It may be the Xmas spirit, but I think @GaryMarcus and Yoshua Bengio are actually converging towards a common ground. Really enjoyed the #AIDebate especially the effort of bringing different points of view towards a shared goal. Great outlook for 2020.",2019-12-24 09:47:53,Tue Dec 24 09:47:53 +0000 2019,2,5,@GaryMarcus,#AIDebate,,,1157238215104798723
223,1209397881473585152,https://twitter.com/BennieMols/status/1209397881473585152,,"No better way to end the #AI -year 2019 than with this #AIdebate between @GaryMarcus and Yoshua Bengio on how to move forward with AI. How to get from deep learning to deep understanding? We need more of such open, constructive, non-polarising discussions. https://www. youtube.com/watch?v=pKgsea ENkAU&feature=youtu.be …",2019-12-24 08:58:19,Tue Dec 24 08:58:19 +0000 2019,11,40,@GaryMarcus,#AI #AIdebate,,https://www.youtube.com/watch?v=pKgseaENkAU&feature=youtu.be,148440338
224,1209397535481061381,https://twitter.com/RoozbehMottaghi/status/1209397535481061381,,Happy that my question on “reasoning” got discussed in #AIDebate . I really wanted to hear Yoshua’s view. I already knew @GaryMarcus ‘s view :),2019-12-24 08:56:56,Tue Dec 24 08:56:56 +0000 2019,1,11,@GaryMarcus,#AIDebate,,,1138872700376571905
225,1209397379717378049,https://twitter.com/simonejomoore/status/1209397379717378049,,#AIDebate Montreal “AI will come before AV” the irony! :D #CX #Customerexperience,2019-12-24 08:56:19,Tue Dec 24 08:56:19 +0000 2019,0,1,,#AIDebate #CX #Customerexperience,,,176973813
226,1209395884900925440,https://twitter.com/vitojph/status/1209395884900925440,,"El #AIDebate de anoche entre #JoshuaBengio y @GaryMarcus está disponible aquí https://www. facebook.com/MontrealAI/vid eos/498403850881660/ … , a partir de 1h46m",2019-12-24 08:50:23,Tue Dec 24 08:50:23 +0000 2019,1,6,@GaryMarcus,#AIDebate #JoshuaBengio,,https://www.facebook.com/MontrealAI/videos/498403850881660/,24897144
227,1209395832140623873,https://twitter.com/AlanMorrison/status/1209395832140623873,,"3/ Look at Stardog XGBoost: http:// stardog.com/blog/boosting- … This stuff is commercial, not just academic. Bengio seems unable to think outside the NN tribal sphere, but these #semantics folks are, in line with what Pedro Domingos talked about in The Master Algorithm. #AIDebate",2019-12-24 08:50:10,Tue Dec 24 08:50:10 +0000 2019,0,1,,#semantics #AIDebate,,http://stardog.com/blog/boosting-,7005092
228,1209393428989009920,https://twitter.com/AlanMorrison/status/1209393428989009920,,"/2 Look at what Cambridge Semantics is doing with Anzo for Machine Learning: RDF/OWL on the back end. Semweb is current KR, is all. https:// bit.ly/2Ziw3zm #AIdebate",2019-12-24 08:40:37,Tue Dec 24 08:40:37 +0000 2019,0,0,,#AIdebate,,https://bit.ly/2Ziw3zm,7005092
229,1209392642632503296,https://twitter.com/AlanMorrison/status/1209392642632503296,,"1/ You're not up to date. Lots of folks are still innovating in KR and now using it as a base for ML. Look at #KBpedia , for example. Whole thing is built with Peircean triadic logic. https:// bit.ly/2EKMPhn #AIdebate",2019-12-24 08:37:30,Tue Dec 24 08:37:30 +0000 2019,0,1,,#KBpedia #AIdebate,,https://bit.ly/2EKMPhn,7005092
230,1209390526639722496,https://twitter.com/_MichaelZink/status/1209390526639722496,,"If you missed the #AIDebate , you should definitely watch the recording. It was incredibly insightful and a great example of a thoughtful and honest intellectual discourse. Thank you both for sharing your perspectives. https:// twitter.com/garymarcus/sta tus/1209299647489085443 …",2019-12-24 08:29:05,Tue Dec 24 08:29:05 +0000 2019,1,3,,#AIDebate,,https://twitter.com/garymarcus/status/1209299647489085443,966039620415717377
231,1209390398927462400,https://twitter.com/AymericPM/status/1209390398927462400,,"En France, par la manière dont la Science s'est faite, beaucoup des idées autour de l'hybridation ne sont pas naturelles. La formation aussi reste encore trop en silos. Il faut aller lire les échanges autour de #AIDebate pour voir les étincelles qui jaillissent.",2019-12-24 08:28:35,Tue Dec 24 08:28:35 +0000 2019,0,1,,#AIDebate,,,11048002
232,1209390382632574976,https://twitter.com/AymericPM/status/1209390382632574976,,"Je suis frappé de voir ces derniers temps autant de chercheurs en #MachineLearning , en particulier de jeunes chercheurs, dire qu'ils vont s'intéresser de plus près à d'autres méthodes, à leur combinaison, et aussi aux fondements neurobiologiques. C'est l'effet #AIDebate .",2019-12-24 08:28:31,Tue Dec 24 08:28:31 +0000 2019,2,6,,#MachineLearning #AIDebate,,,11048002
233,1209379233832849409,https://twitter.com/DataScienceNIG/status/1209379233832849409,,You need to watch the brilliant #AIdebate between Yoshua Bengio & @GaryMarcus last night. Non-polarizing discourse with more agreement than disagreements. Clear consensus on creating #responsibleAI & hybrid methods (deep learning +symbolic AI) Watch https:// youtu.be/pKgseaENkAU pic.twitter.com/UFeXxdwGsz,2019-12-24 07:44:13,Tue Dec 24 07:44:13 +0000 2019,37,97,@GaryMarcus,#AIdebate #responsibleAI,,https://youtu.be/pKgseaENkAU,897785725680267265
234,1209365551039959040,https://twitter.com/4deep_prk/status/1209365551039959040,,https:// youtu.be/pKgseaENkAU more agreements than disagreements @GaryMarcus liked the presentation #AIDebate,2019-12-24 06:49:50,Tue Dec 24 06:49:50 +0000 2019,2,6,@GaryMarcus,#AIDebate,,https://youtu.be/pKgseaENkAU,1155888403088412673
235,1209351094310182912,https://twitter.com/eaxitect/status/1209351094310182912,,"From #AIDebate stand point @GaryMarcus (i.e. Symbolic/DL Hybrid approach on #artificialintelligence ) is winner, albeit both Marcus and Bengio agreed on many things/aspects. However debate raised more questions than it answered (at least for me). TR: Dun… https:// lnkd.in/dxsy7hi",2019-12-24 05:52:24,Tue Dec 24 05:52:24 +0000 2019,1,5,@GaryMarcus,#AIDebate #artificialintelligence,,https://lnkd.in/dxsy7hi,49920135
236,1209339262879055873,https://twitter.com/JoukoSalonen/status/1209339262879055873,,"https:// montrealartificialintelligence.com/aidebate/ Twitter comments: #AIDebate My summary: 2 deaf males trimming the beard of Zeus, convergency theatre, but #lekta & #polyphony missing pic.twitter.com/XhPRnixAoZ",2019-12-24 05:05:23,Tue Dec 24 05:05:23 +0000 2019,0,0,,#AIDebate #lekta #polyphony,,https://montrealartificialintelligence.com/aidebate/,22868434
